{
  "$schema": "https://json-schema.org/draft/2020-12/schema",
  "$id": "research_window.schema.json",
  "title": "Resolved nightly research window",
  "type": "object",
  "required": [
    "schema_version",
    "target_date",
    "previous_trading_day",
    "research_cutoff",
    "research_window"
  ],
  "properties": {
    "schema_version": {"const": 1},
    "target_date": {"type": "string", "format": "date"},
    "previous_trading_day": {"type": "string", "format": "date"},
    "research_cutoff": {"type": "string", "format": "date-time"},
    "research_window": {"$ref": "#/$defs/researchWindow"}
  },
  "additionalProperties": false,
  "$defs": {
    "researchWindow": {
      "type": "object",
      "required": [
        "run_type",
        "window_start",
        "window_end",
        "previous_research_cutoff",
        "previous_run_date",
        "bootstrap_lookback_days"
      ],
      "properties": {
        "run_type": {"enum": ["FIRST_RUN", "NORMAL_RUN"]},
        "window_start": {"type": "string", "format": "date-time"},
        "window_end": {"type": "string", "format": "date-time"},
        "previous_research_cutoff": {"type": ["string", "null"], "format": "date-time"},
        "previous_run_date": {"type": ["string", "null"], "format": "date"},
        "bootstrap_lookback_days": {"type": ["integer", "null"], "minimum": 1}
      },
      "additionalProperties": false,
      "allOf": [
        {
          "if": {
            "required": ["run_type"],
            "properties": {"run_type": {"const": "FIRST_RUN"}}
          },
          "then": {
            "properties": {
              "previous_research_cutoff": {"type": "null"},
              "previous_run_date": {"type": "null"},
              "bootstrap_lookback_days": {"type": "integer", "minimum": 1}
            }
          }
        },
        {
          "if": {
            "required": ["run_type"],
            "properties": {"run_type": {"const": "NORMAL_RUN"}}
          },
          "then": {
            "properties": {
              "previous_research_cutoff": {"type": "string", "format": "date-time"},
              "previous_run_date": {"type": "string", "format": "date"},
              "bootstrap_lookback_days": {"type": "null"}
            }
          }
        }
      ]
    }
  }
}
