{
  "schema_version": 1,
  "target_date": "2026-08-10",
  "previous_trading_day": "2026-08-07",
  "research_cutoff": "2026-08-07T20:00:00+09:00",
  "research_window": {
    "run_type": "FIRST_RUN",
    "window_start": "2026-08-06T20:00:00+09:00",
    "window_end": "2026-08-07T20:00:00+09:00",
    "previous_research_cutoff": null,
    "previous_run_date": null,
    "bootstrap_lookback_days": 1
  }
}
